{
    "$schema": "../../../schemas/replay.schema.json",
    "schemaVersion": "1.0.0",
    "gameId": "emberfall",
    "gameVersion": "0.4.0",
    "matchId": null,
    "mode": "simulation",
    "seed": 48,
    "config": {
        "mulligan": false,
        "roundCap": 25
    },
    "seats": [
        {
            "seat": 0,
            "deck": "examples/emberfall/decks/ember-aggro.json",
            "agent": "emberfall-heuristic-aggro",
            "label": "Ember"
        },
        {
            "seat": 1,
            "deck": "examples/emberfall/decks/ash-control.json",
            "agent": "emberfall-heuristic-aggro",
            "label": "Ash"
        }
    ],
    "actions": [
        {
            "seq": 1,
            "seat": 0,
            "actionId": "play_character",
            "params": {
                "card": "i-p0-2"
            },
            "note": "Round 1 income is min(round+1,6)=2. Cinder Scout for 1."
        },
        {
            "seq": 2,
            "seat": 1,
            "actionId": "play_character",
            "params": {
                "card": "i-p1-11"
            },
            "note": "Dust Weaver for 2. Its Bolster trigger finds no other friendly character; the target is optional, so it resolves silently with no choice raised."
        },
        {
            "seq": 3,
            "seat": 0,
            "actionId": "play_attachment",
            "params": {
                "card": "i-p0-20",
                "host": "i-p0-2"
            },
            "note": "Ember Brand on the Scout. Attack becomes 4 (2 base at layer 0, +2 at layer 6)."
        },
        {
            "seq": 4,
            "seat": 1,
            "actionId": "pass"
        },
        {
            "seq": 5,
            "seat": 0,
            "actionId": "pass",
            "note": "Two consecutive passes end action.main."
        },
        {
            "seq": 6,
            "seat": 0,
            "actionId": "declare_attack",
            "params": {
                "attacker": "i-p0-2"
            },
            "note": "Legal on the round it entered play only because Swift grants attack_while_summoning_sick."
        },
        {
            "seq": 7,
            "seat": 1,
            "actionId": "pass",
            "note": "Declining to block: trading a 1/2 into a 4-attack body is worse than taking 4. Enemy hero damage 4."
        },
        {
            "seq": 8,
            "seat": 1,
            "actionId": "pass",
            "note": "Round 2. First player alternates, so Ash acts first. It holds Smother and passes on 3 Ember."
        },
        {
            "seq": 9,
            "seat": 0,
            "actionId": "play_character",
            "params": {
                "card": "i-p0-23"
            },
            "note": "Wandering Emberkin, 2/2, for 2."
        },
        {
            "seq": 10,
            "seat": 1,
            "actionId": "play_event",
            "params": {
                "card": "i-p1-14"
            },
            "choice": {
                "victim": "i-p0-23"
            },
            "note": "Smother destroys the Emberkin. The branded Cinder Scout is NOT a legal target: Smother's query reads current attack (4), not printed attack (2). Pinning this is the point of the fixture."
        },
        {
            "seq": 11,
            "seat": 0,
            "actionId": "pass"
        },
        {
            "seq": 12,
            "seat": 1,
            "actionId": "pass"
        },
        {
            "seq": 13,
            "seat": 1,
            "actionId": "declare_attack",
            "params": {
                "attacker": "i-p1-11"
            },
            "note": "Dust Weaver attacks; it entered play last round, so no permission is needed."
        },
        {
            "seq": 14,
            "seat": 0,
            "actionId": "declare_block",
            "params": {
                "blocker": "i-p0-2",
                "attacker": "i-p1-11"
            },
            "note": "Scout blocks. Simultaneous strike: the 4-attack Scout kills the 1/2 Weaver, and the Weaver's 1 damage kills the 1-health Scout, so both go to the discard. Every amount is read before any is applied, which is why the Weaver's death does not spare the Scout."
        }
    ],
    "provenance": {
        "recordedBy": "gmd replay --bless",
        "reason": "The opening step of a match now emits step.began like every other step, which advances __eventSeq by one. No rule changed: a full 24-round match produces a byte-identical event stream and differs only in that counter."
    },
    "expected": {
        "finalStateHash": "sha256:200ae3b48b05005e5ae61e5bef7d500305e6ca16853b5973addddd875668dce5",
        "checkpoints": [
            {
                "seq": 1,
                "stateHash": "sha256:a8062f96a8ff24b10eb293c418e0209c64aad3dc9f4d41d12987df8da7c58436"
            },
            {
                "seq": 2,
                "stateHash": "sha256:4975cf447d3da85927e327bd57eef5e330ea7f18a651f0a5f9dfdc42c987a0fa"
            },
            {
                "seq": 3,
                "stateHash": "sha256:903ecea9fb7dca0affe2c328ca46f3bff447b5946b6a38b2ed7e44ea25d678b7"
            },
            {
                "seq": 4,
                "stateHash": "sha256:60d124c7074cf91b23dd8d516b8e2ed774a2ac3f60a8365d16664db5f86f98f7"
            },
            {
                "seq": 5,
                "stateHash": "sha256:bead4e35777d18a7a60df6db5816cfb0485877c1f2f373035ea06949a6ecb269"
            },
            {
                "seq": 6,
                "stateHash": "sha256:18265c2d39dae049288221e5b1d3d2ee6c963fe2b10081650e10006f8b050966"
            },
            {
                "seq": 7,
                "stateHash": "sha256:86a942738737baecb11b4f6a0da3025a1c6c473d38edf0f32bcb350f836c6541"
            },
            {
                "seq": 8,
                "stateHash": "sha256:11d7f8e6eb13e77e2fddb7bf984cb9e621f5893bd878f6229b79050f45334b7e"
            },
            {
                "seq": 9,
                "stateHash": "sha256:f2198c1c5a82c75e3f2ec4134682fa1238f297c2bc48e83b77b929caabc9b17a"
            },
            {
                "seq": 10,
                "stateHash": "sha256:42b18732e1b6be8a0b7fc6063943a39d4ec93c28e304e62e96bba96ad9595706"
            },
            {
                "seq": 11,
                "stateHash": "sha256:2481dfe7107f592d22797601f95f2b46b94ed31197fd2174970f8fe8541517a9"
            },
            {
                "seq": 12,
                "stateHash": "sha256:3200359fdf0af2072729b66c8343d0eb1fc3b228e2dd5ad65ac8c693d45cb2cf"
            },
            {
                "seq": 13,
                "stateHash": "sha256:a25df68606cf0bf805d2f4e39fa812c539bf9048fe8540745e7fd9e47a80e3d2"
            },
            {
                "seq": 14,
                "stateHash": "sha256:200ae3b48b05005e5ae61e5bef7d500305e6ca16853b5973addddd875668dce5"
            }
        ]
    }
}
